{"answer":"Found 2 arbitrators matching \"Bradley Areheart\":\n- Bradley A. Areheart Esq.\n- Bradley Areheart\n\nCombined cases (showing all 4 of 4 total):\n\n1.    Case ID: 012100044985\n      Case Type: Consumer\n      Arbitrator: Bradley Areheart\n      Respondent: AT&T\n      Disposition: Awarded\n      Award Amount: $2157.78\n\n2.    Case ID: 012100026335\n      Case Type: Consumer\n      Arbitrator: Bradley Areheart\n      Respondent: Verizon\n      Disposition: Awarded\n      Award Amount: $830.44\n\n3.    Case ID: 012000155455\n      Case Type: Consumer\n      Arbitrator: Bradley Areheart\n      Respondent: AT&T\n      Disposition: Awarded\n      Award Amount: $2977.71\n\n4.    Case ID: 012000042152\n      Case Type: Consumer\n      Arbitrator: Bradley A. Areheart Esq.\n      Respondent: TurboTax\n      Disposition: Withdrawn\n\n","data":{"cases":[{"caseId":"012100044985","arbitratorName":"Bradley Areheart","respondentName":"AT&T","disposition":"Awarded","caseType":"Consumer","awardAmount":"2157.78"},{"caseId":"012100026335","arbitratorName":"Bradley Areheart","respondentName":"Verizon","disposition":"Awarded","caseType":"Consumer","awardAmount":"830.44"},{"caseId":"012000155455","arbitratorName":"Bradley Areheart","respondentName":"AT&T","disposition":"Awarded","caseType":"Consumer","awardAmount":"2977.71"},{"caseId":"012000042152","arbitratorName":"Bradley A. Areheart Esq.","respondentName":"TurboTax","disposition":"Withdrawn","caseType":"Consumer","awardAmount":"0"}],"matchingNames":["Bradley A. Areheart Esq.","Bradley Areheart"],"totalCaseCount":4},"queryType":"arbitrator_case_listing"}